{
  "authority": "W3C",
  "canonical_id": "transversal-public.trv-010.source",
  "integrity": {
    "sha256": "6b96671ab84faf12ce3f041aca12c3f93a6df2ed242348810743179a68e69555",
    "snapshot_ref": "audit-evidence/transversal-acquisition/snapshots/20261024/public-standards-w3c/trv-010/original.html"
  },
  "jurisdiction": "Internacional",
  "license_ref": "audit-evidence/transversal-acquisition/snapshots/20261024/public-standards-w3c/trv-010/LICENSE-AND-ATTRIBUTION.txt",
  "locator": {
    "pinpoint": "Documento completo arquivado; nenhuma cláusula individual verificada",
    "uri": "https://www.w3.org/TR/prov-o/"
  },
  "provenance_refs": [
    "audit-evidence/transversal-acquisition/snapshots/20261024/manifest.json",
    "audit-evidence/transversal-acquisition/snapshots/20261024/public-standards-w3c/trv-010/original.html"
  ],
  "retrieved_at": "2026-10-24",
  "rights": "LICENSED",
  "schema_version": "0.1.0",
  "source_type": "STANDARD",
  "status": "CANDIDATE",
  "title": "PROV-O: The PROV Ontology",
  "updated_at": "2026-10-24",
  "version": "snapshot-2026-10-24"
}
